{
  "$schema": "https://json-schema.org/draft/2020-12/schema",
  "$id": "urn:local-recipes:pyforge-doctor:report-schema",
  "title": "DoctorReport",
  "description": "The frozen envelope for pyforge-doctor (Story 1.1): one document per invocation, {schema_version, verb, generated_at, findings, prescriptions}. prescriptions is present (an array, possibly empty) ONLY when verb == 'diagnose'; for 'check'/'monitor' the key must be entirely absent (never null). grade/axis_scores (Story 4.1) are optional additive fields present only on a report the CLI actually computed a grade for (today: 'diagnose'). additionalProperties is deliberately left open on findings/prescriptions sub-objects: additive growth (a new evidence shape, new rank_factors keys) is never a schema break.",
  "type": "object",
  "required": ["schema_version", "verb", "generated_at", "findings"],
  "properties": {
    "schema_version": {
      "type": "integer",
      "minimum": 1,
      "description": "Envelope schema version; starts at 1 (carries warden's ComplianceReport precedent — schema-validated, versioned — forward)."
    },
    "verb": {
      "enum": ["check", "monitor", "diagnose", "backlog-intake"],
      "description": "The CLI verb that produced this report."
    },
    "generated_at": {
      "type": "string",
      "description": "ISO-8601 timestamp the report was generated at."
    },
    "findings": {
      "type": "array",
      "items": { "$ref": "#/$defs/finding" }
    },
    "prescriptions": {
      "type": "array",
      "items": { "$ref": "#/$defs/prescription" }
    },
    "grade": {
      "enum": ["A", "B", "C", "D", "F", "incomplete"],
      "description": "Story 4.1: composite health grade over this report's own findings; present only when the CLI computed one."
    },
    "axis_scores": {
      "type": "array",
      "description": "Story 4.1: per-Source axis breakdown backing 'grade'; present only alongside 'grade'.",
      "items": { "$ref": "#/$defs/axis_score" }
    }
  },
  "if": {
    "required": ["verb"],
    "properties": { "verb": { "const": "diagnose" } }
  },
  "then": {
    "required": ["prescriptions"]
  },
  "else": {
    "not": { "required": ["prescriptions"] }
  },
  "$defs": {
    "finding": {
      "type": "object",
      "required": ["source", "check", "status", "message", "evidence"],
      "properties": {
        "source": {
          "enum": [
            "warden-doctor",
            "staleness-report",
            "cve-watcher",
            "behind-upstream",
            "feedstock-health",
            "release-cadence",
            "env-hygiene",
            "adoption",
            "marshal-durability",
            "ledger-regression",
            "ledger-direction",
            "story-status",
            "chain-completeness",
            "dashboard-drift",
            "check-layout",
            "dream-chain",
            "spec-surface",
            "deferred-work",
            "forward-dependency",
            "bmad-drift",
            "bmad-output-hygiene",
            "due-for-verification",
            "bmad-method-version-drift",
            "backlog-intake",
            "sibling-dreams-drift",
            "ci-pause-drift",
            "pages-liveness",
            "dreams-hygiene",
            "chain-layers-audit",
            "platform-policy-suite",
            "bmad-render-config-ambiguity",
            "frozen-path-changed",
            "capability-effect",
            "status-body-consistency",
            "pixi-currency-ledger",
            "general-docs-consistency",
            "capability-ledger",
            "chain-sprawl",
            "fr-without-cap",
            "fold-complete",
            "docs-map-hygiene",
            "docs-shelf-occupancy",
            "live-proof-surface",
            "docs-currency",
            "frontmatter-duplicate-keys"
          ]
        },
        "check": { "type": "string" },
        "status": { "enum": ["ok", "warn", "fail"] },
        "message": { "type": "string" },
        "evidence": {
          "type": "object",
          "description": "Source-specific object, opaque to this envelope."
        }
      }
    },
    "prescription": {
      "type": "object",
      "required": [
        "finding_ref",
        "partition",
        "rank",
        "rank_factors",
        "action",
        "root_cause",
        "safe_upgrade_target",
        "safe_upgrade_reason"
      ],
      "properties": {
        "finding_ref": { "type": "string" },
        "partition": { "enum": ["actionable", "blocked", "accepted-risk"] },
        "rank": {
          "type": ["integer", "null"],
          "description": "Populated by a later epic's ranking pass; null until then."
        },
        "rank_factors": {
          "type": ["object", "null"],
          "description": "Populated by a later epic's ranking pass; null until then."
        },
        "action": { "type": "string" },
        "root_cause": { "type": "string" },
        "safe_upgrade_target": {
          "type": ["string", "null"],
          "description": "Story 4.4: a single-hop next-safe-version recommendation; null when not confidently known (see safe_upgrade_reason)."
        },
        "safe_upgrade_reason": {
          "type": ["string", "null"],
          "description": "Story 4.4: always states why safe_upgrade_target is (or isn't) populated."
        }
      }
    },
    "axis_score": {
      "type": "object",
      "required": ["axis", "ok", "warn", "fail", "grade"],
      "properties": {
        "axis": { "type": "string" },
        "ok": { "type": "integer", "minimum": 0 },
        "warn": { "type": "integer", "minimum": 0 },
        "fail": { "type": "integer", "minimum": 0 },
        "grade": { "enum": ["A", "B", "C", "D", "F", "incomplete"] }
      }
    }
  }
}
